{
  "schemaVersion": 1,
  "packageClassificationSha256": "a8a069a2946c2e93f92121378d57857da4f038fac000e4f73ff4c465de320365",
  "pathRepairsSha256": "8157d74014064be02a360c77a4610c889c8998798504da2930d8cf8794bcb2ad",
  "baselinesSha256": "067aba9638577ece965e0ca7527e659ff6658dd97bb57c90ec9060fe2901ccd9",
  "executionLockSha256": "c91e729ab343ffc652216dbcf9e4b8b3d650a6f1fecb8562dad7f419ba967aed",
  "installPolicy": {
    "argv": [
      "npm",
      "ci",
      "--ignore-scripts",
      "--no-audit",
      "--no-fund",
      "--loglevel=error"
    ],
    "environment": {
      "CI": "1",
      "HUSKY": "0",
      "LC_ALL": "C",
      "TZ": "UTC"
    },
    "sandbox": "outside-repository-ancestry",
    "lockMutation": "forbidden"
  },
  "counts": {
    "projects": 16,
    "runnable": 14,
    "templates": 2,
    "localLocks": 14,
    "browserProjects": 10,
    "internalEdges": 37,
    "declaredEdges": 23,
    "legacyInjectedEdges": 14,
    "registryBaselineRecords": 21,
    "ordinaryExamples": 14
  },
  "projects": [
    {
      "id": "core/integration/typescript-3.9",
      "sourceManifest": "core/integration/typescript-3.9/package.json",
      "manifest": "core/integration-tests/typescript-3.9/package.json",
      "mode": "runnable",
      "name": "@uirouter/internal-core-integration-typescript-3-9",
      "manifestSha256": "e2a593b022140e9037d5ca836821ce211c2461b23c792b06d7ca810e57dc676d",
      "scriptsSha256": "7229047fb1f14160617d6e3be77c9a946848db1d10d57ef2abfd91ed5d8fd27d",
      "commands": {
        "test": "test",
        "e2e": null,
        "setupBrowser": null
      },
      "lock": {
        "path": "core/integration-tests/typescript-3.9/package-lock.json",
        "sha256": "b2558f23e8f1a42fb623ba8d24dfc332f9a26e6b6112814bc525d1406625ca52",
        "packageEntries": 3
      },
      "generatorScript": null,
      "manifestBaselineId": "core.manifest.test/typescript3.9.static",
      "downstreamDiscoveryBaselineId": "core.downstream.other.typescript3.9.discovery",
      "downstreamBaselineIds": [
        "core.downstream.all",
        "core.downstream.other",
        "core.downstream.other.typescript3.9.discovery"
      ],
      "internalEdgeIds": [
        "edge-core-integration-typescript-3-9-dependencies-uirouter-core",
        "edge-core-integration-typescript-3-9-legacy-injected-uirouter-core-other-typescript3-9"
      ],
      "declaredEdgeIds": [
        "edge-core-integration-typescript-3-9-dependencies-uirouter-core"
      ],
      "legacyInjectedEdgeIds": [
        "edge-core-integration-typescript-3-9-legacy-injected-uirouter-core-other-typescript3-9"
      ],
      "registryBaselineRecords": [
        {
          "edgeId": "edge-core-integration-typescript-3-9-dependencies-uirouter-core",
          "package": "@uirouter/core",
          "version": "6.1.2",
          "resolved": "https://registry.npmjs.org/@uirouter/core/-/core-6.1.2.tgz",
          "integrity": "sha512-pYcg+cxVd9E9poC7AJf7ZrlQQrwAV6KVkiPvlbLJX5km+pBWrUOGQhdd87oIGc7/5iVQ7qSiAdl9QD+l55yegg=="
        }
      ]
    },
    {
      "id": "core/integration/typescript-5.4",
      "sourceManifest": "core/integration/typescript-5.4/package.json",
      "manifest": "core/integration-tests/typescript-5.4/package.json",
      "mode": "runnable",
      "name": "@uirouter/internal-core-integration-typescript-5-4",
      "manifestSha256": "b900026811c92f7f0d464e79ac06124190aa3576278b54cf91314d595792d654",
      "scriptsSha256": "7229047fb1f14160617d6e3be77c9a946848db1d10d57ef2abfd91ed5d8fd27d",
      "commands": {
        "test": "test",
        "e2e": null,
        "setupBrowser": null
      },
      "lock": {
        "path": "core/integration-tests/typescript-5.4/package-lock.json",
        "sha256": "a7d57a24f721e474a37d248b244e0e8fe9bdef70619e6cc4d82a1d29b8abfbd4",
        "packageEntries": 3
      },
      "generatorScript": null,
      "manifestBaselineId": "core.manifest.test/typescript5.4.static",
      "downstreamDiscoveryBaselineId": "core.downstream.other.typescript5.4.discovery",
      "downstreamBaselineIds": [
        "core.downstream.all",
        "core.downstream.other",
        "core.downstream.other.typescript5.4.discovery"
      ],
      "internalEdgeIds": [
        "edge-core-integration-typescript-5-4-dependencies-uirouter-core",
        "edge-core-integration-typescript-5-4-legacy-injected-uirouter-core-other-typescript5-4"
      ],
      "declaredEdgeIds": [
        "edge-core-integration-typescript-5-4-dependencies-uirouter-core"
      ],
      "legacyInjectedEdgeIds": [
        "edge-core-integration-typescript-5-4-legacy-injected-uirouter-core-other-typescript5-4"
      ],
      "registryBaselineRecords": [
        {
          "edgeId": "edge-core-integration-typescript-5-4-dependencies-uirouter-core",
          "package": "@uirouter/core",
          "version": "6.1.2",
          "resolved": "https://registry.npmjs.org/@uirouter/core/-/core-6.1.2.tgz",
          "integrity": "sha512-pYcg+cxVd9E9poC7AJf7ZrlQQrwAV6KVkiPvlbLJX5km+pBWrUOGQhdd87oIGc7/5iVQ7qSiAdl9QD+l55yegg=="
        }
      ]
    },
    {
      "id": "framework/angular/integration/angular-versions/v22",
      "sourceManifest": "framework/angular/integration/angular-versions/v22/package.json",
      "manifest": "frameworks/angular/integration-tests/angular-versions/v22/package.json",
      "mode": "runnable",
      "name": "@uirouter/internal-framework-angular-integration-angular-versions-v22",
      "manifestSha256": "f18f66f89c644124ca8a171594d7c28a9e03f08388a71576061ffc5abd24e16f",
      "scriptsSha256": "b842fc1376eb13e4ae21ada3c3a4a2d5587127fbfccef3e35eb65c178f480264",
      "commands": {
        "test": "test",
        "e2e": "e2e",
        "setupBrowser": "setup:browser"
      },
      "lock": {
        "path": "frameworks/angular/integration-tests/angular-versions/v22/package-lock.json",
        "sha256": "7d56750b55dad7b9af972deedc1ddda11be619cea496f6345a3af8056777ba6f",
        "packageEntries": 545
      },
      "generatorScript": null,
      "manifestBaselineId": "angular.manifest.test-angular-versions/v22.static",
      "downstreamDiscoveryBaselineId": "angular.downstream.default.angular22.discovery",
      "downstreamBaselineIds": [
        "angular.downstream.all",
        "angular.downstream.default.angular22.discovery"
      ],
      "internalEdgeIds": [
        "edge-framework-angular-integration-angular-versions-v22-dependencies-uirouter-angular",
        "edge-framework-angular-integration-angular-versions-v22-dependencies-uirouter-core",
        "edge-framework-angular-integration-angular-versions-v22-dependencies-uirouter-rx",
        "edge-framework-angular-integration-angular-versions-v22-legacy-injected-uirouter-angular-default-angular22"
      ],
      "declaredEdgeIds": [
        "edge-framework-angular-integration-angular-versions-v22-dependencies-uirouter-angular",
        "edge-framework-angular-integration-angular-versions-v22-dependencies-uirouter-core",
        "edge-framework-angular-integration-angular-versions-v22-dependencies-uirouter-rx"
      ],
      "legacyInjectedEdgeIds": [
        "edge-framework-angular-integration-angular-versions-v22-legacy-injected-uirouter-angular-default-angular22"
      ],
      "registryBaselineRecords": [
        {
          "edgeId": "edge-framework-angular-integration-angular-versions-v22-dependencies-uirouter-angular",
          "package": "@uirouter/angular",
          "version": "22.0.0",
          "resolved": "https://registry.npmjs.org/@uirouter/angular/-/angular-22.0.0.tgz",
          "integrity": "sha512-wNvtdLCm/bS/o29XjxQmy7iYL5+i8+pLeel8h9LFs/Wc/pyltJlJ7XEm2wRPIHaZCawSQTOngaJZpHs/Pq/l7A=="
        },
        {
          "edgeId": "edge-framework-angular-integration-angular-versions-v22-dependencies-uirouter-core",
          "package": "@uirouter/core",
          "version": "6.1.2",
          "resolved": "https://registry.npmjs.org/@uirouter/core/-/core-6.1.2.tgz",
          "integrity": "sha512-pYcg+cxVd9E9poC7AJf7ZrlQQrwAV6KVkiPvlbLJX5km+pBWrUOGQhdd87oIGc7/5iVQ7qSiAdl9QD+l55yegg=="
        },
        {
          "edgeId": "edge-framework-angular-integration-angular-versions-v22-dependencies-uirouter-rx",
          "package": "@uirouter/rx",
          "version": "1.0.0",
          "resolved": "https://registry.npmjs.org/@uirouter/rx/-/rx-1.0.0.tgz",
          "integrity": "sha512-dqPmLFC+qqF6RIdJVKktXSON6WILy2oyLhADDk74F3GAUZ/VvOu3QSPLDtZEP3LMSo6vkGQvwcUdjgNVWL3YJA=="
        }
      ]
    },
    {
      "id": "framework/angular/integration/angular-versions/v22-standalone",
      "sourceManifest": "framework/angular/integration/angular-versions/v22-standalone/package.json",
      "manifest": "frameworks/angular/integration-tests/angular-versions/v22-standalone/package.json",
      "mode": "runnable",
      "name": "@uirouter/internal-framework-angular-integration-angular-versions-v22-standalone",
      "manifestSha256": "d6715860635d9b327b582d0c7e8cf68150fef97d141baf3832d9f942cc195f0e",
      "scriptsSha256": "69f3ae03dde2ff3ea898e61c34a6d1b484192448e6008f455d18bd385dc5c52e",
      "commands": {
        "test": "test",
        "e2e": "e2e",
        "setupBrowser": "setup:browser"
      },
      "lock": {
        "path": "frameworks/angular/integration-tests/angular-versions/v22-standalone/package-lock.json",
        "sha256": "13bfd3403325e990b6b43cc928173d491b665ab1f328fb80a173724a700b5132",
        "packageEntries": 545
      },
      "generatorScript": null,
      "manifestBaselineId": "angular.manifest.test-angular-versions/v22-standalone.static",
      "downstreamDiscoveryBaselineId": "angular.downstream.default.angular22standalone.discovery",
      "downstreamBaselineIds": [
        "angular.downstream.all",
        "angular.downstream.default.angular22standalone.discovery"
      ],
      "internalEdgeIds": [
        "edge-framework-angular-integration-angular-versions-v22-standalone-dependencies-uirouter-angular",